Opening,Opening.1,Title,Director,Actors,Genre,Notes,Ref,Cast
J A N,7,Thamizh Desam,Thamizh Selva,"Raghuvannan, Varshini",Drama,,[3],
J A N,14,Aadukalam,Vetrimaran,"Dhanush, Taapsee Pannu, Kishore",Drama,Produced by Five Star Films,[4],
J A N,14,Siruthai,Siva,"Karthi, Tamannaah","Action, Masala",Produced by Studio Green,[4],
J A N,15 (Pongal),Ilaignan,Suresh Krishna,"Pa. Vijay, Remya Nambeesan, Meera Jasmine, Namitha",Drama,Produced by Martin Production,[5],
J A N,15 (Pongal),Kaavalan,Siddique,"Vijay, Asin, Mithra Kurian",Romantic comedy,Produced by Ekaveera Creations,[6],
J A N,15 (Pongal),Sollitharava,S. Sivaraman,"Sivan, Sharmila, Nivedhita",Romance,Produced by Foot Steps Production,[7],
J A N,28,Pathinaaru,D. Sabapathy,"Shiva, Madhu Shalini",Romantic drama,Produced by Passion Movie Makers,[8],
J A N,28,Pazhagiyathe Pirivatharka,S. A. Selvakumar,"Selvam, Tharuna",Romance,Siva Jothi Films Banner,[8],
J A N,28,Vaada Poda Nanbargal,Manigai,"Nandha, Sharran Kumar, Yashika",Romance,Produced by 8 Point Entertainment,[8],
F E B,4,Yuddham Sei,Myshkin,"Cheran, Dipa Shah, Y. Gee. Mahendra",Crime thriller,Produced by AGS Entertainment,[9],
F E B,4,Thoonga Nagaram,Gaurav,"Vimal, Anjali, Bharani, Nishanth, Gaurav",Drama,Produced by Cloud Nine Movies,[9],
F E B,11,Idhu Kadhal Uthirum Kaalam,P.K.Shivashri,"T.Jayanraj, P.K.Shivashri",Romance,,[10],
F E B,11,Nandhi,Thamizhvanan,"Akhil, Sanusha",Drama,Produced by Vision X Media,[10],
F E B,11,Payanam,Radha Mohan,"Nagarjuna, Prakash Raj, Sana Khan, Poonam Kaur","Thriller, Drama",Produced by Silent Movies,[10],
F E B,11,Thambikottai,Ammu Ramesh,"Narain, Poonam Bajwa, Meena","Action, Masala",Produced by Rajeshwari Films,[11],
F E B,11,Varmam,A. S. Lawrence Madhavan,"Akilan, Anaka, Nizhalgal Ravi",Crime thriller,Produced by Crescent Creations,[10],
F E B,18,Aadu Puli,Vijay Prakash,"Aadhi, Poorna, Prabhu",Action,Produced by Global Infotainments,[12],
F E B,18,Nadunisi Naaygal,Gautham Vasudev Menon,"Sameera Reddy, Veera Bahu",Psychological thriller,Produced by Photon Kathaas,[12],
F E B,18,Thappu,Akilan,"Vivan, Rani Chaturvedi, Jennifer",Adult,Produced by SSA Movies,[12],
F E B,25,Aaranin Kaaval,K. Dharmaraj,"Ajay, Sonia Bhat",Drama,Produced by Rogan Films,[13],
F E B,25,Margazhi 16,K. Steven,"Jayanth, Srinidhi",Romance,Produced by Jayavishal Arts,[12],
F E B,25,Seedan,Subramaniya Siva,"Ananya, Krishna, Dhanush",Drama,Produced by Mid Productions,[13],
M A R,4,Singam Puli,Sai Ramani,"Jiiva, Divya Spandana, Honey Rose","Action, Masala",Produced by Silverline Film Factory,[14],
M A R,11,Ayyan,Kendiran Muniyasamy,"Vasan Karthik, Divya Padmini",Drama,,[15],
M A R,11,Bhavani,G. Kicha,"Sneha, Kota Srinivasa Rao, Vivek",Action,Produced by Shri Movie Makers,[15],
M A R,11,Aivar,Sai Prasad,"Perarasan, Vijay Anand, Ilah, Athulya",Drama,Produced by AGR Night Films,[15],
M A R,18,Lathika,"R. Bharathan, Dr. Srinivasan","Dr. Srinivasan, Meenakshi Kailash, Rahman",Masala,Produced by Lathika Films,[16],
M A R,18,Minsaram,N. Selvakumar,"Yuvaraaj, Madhusantha, Thol. Thirumavalavan, Sowganthi",Romance,Produced by Kovai Film City,[16],
M A R,18,Avargalum Ivargalum,Veera Pandian,"Sathish, Vimal Natarajan, Aishwarya, Supraja, Agathiyan",Drama,Produced by Lakshika Films,[16],
M A R,18,Muthukku Muthaaga,Rasu Madhuravan,"Vikranth, Natraj, Ilavarasu, Oviya, Monica, Saranya Ponvannan",Drama,Produced by Pandiyanadu Theatres,[16],
M A R,25,Kullanari Koottam,Sribalaji,"Vishnu Vishal, Remya Nambeesan",Romance,,[17],
M A R,25,Kumara,T. K. Shanmughasundaram,"Ratheeshvaratha, Roopashree",Romance,,[17],
M A R,25,Padai Soozha,A. S. Prabhu,"Ganesh Prasad, Prasad Raj, Varshini",Masala,,[17],
M A R,25,Sattapadi Kutram,S. A. Chandrasekhar,"Sathyaraj, Vikranth, Bhanu, Harish Kalyan, Komal Sharma",Action,,[17],
M A R,25,Nil Gavani Sellathey,Anand K. Chakravarthy,"Anand K. Chakravarthy, Jagan, Dhansika, Lakshmi Nair",Suspense thriller,"Produced by Imagine Creations, Re-release",[17],
A P R,1,Appavi,R. Raghuraj,"Gautham, Suhani Kalita, K. Bhagyaraj",Drama,Produced by Chartered Arts,[18],
A P R,1,Nanjupuram,Charles,"Raaghav, Monica","Thriller, Fantasy",Produced by Illusionz Infinite,[18],
A P R,1,Thenkasi Pakkathula,A. Anthony,"Ajay, Ashmitha",Drama,Produced by Classic Combines,[18],
A P R,8,Mappillai,Suraj,"Dhanush, Hansika Motwani, Manisha Koirala",Masala,Produced by Nemichand Jhabak,[19],
A P R,9,Ponnar Shankar,Thyagarajan,"Prashanth, Pooja Chopra, Divya Parameshwaran, Sneha, Khushbu, Prakash Raj, Jayaram",Epic,Produced by Lakshmi Shanthi Movies,[19],
A P R,22,Ko,K. V. Anand,"Jeeva, Karthika Nair, Ajmal, Piaa Bajpai",Thriller,Produced By RS Infotainment,[20],
A P R,22,Vikadakavi,G. Krishnan,"Sathish, Amala Paul",Romance,Produced by ABC Studious,[20],
A P R,29,Kadhal Meipada,Ravi Aacharya,"Vishnu Priyan, Madhumitha, Thalaivasal Vijay",Romance,,[21],
A P R,29,Vaanam,Krish,"Silambarasan, Bharath, Anushka Shetty, Prakash Raj, Saranya","Action, Drama",Produced by VTV Productions & Magic Box Pictures,[21],
A P R,29,Poova Thalaiya,Sanjay Ram,"Krishnakumar, Udhaya, Sherin, Megha Nair",Drama,Produced by Lingam Theatres,[21],
M A Y,6,Engeyum Kadhal,Prabhu Deva,"Jayam Ravi, Hansika Motwani",Romance,Produced by AGS Entertainment,[22],
M A Y,6,Paasakaara Nanbargal,Firoze Khan,"Ajmal Khan, Divya Nagesh",Drama,Produced by Angel Film International,[22],
M A Y,12,Azhagarsamiyin Kuthirai,Suseenthiran,"Appukutty, Saranya Mohan, Advaitha",Comedy drama,Produced by Escape Artists Motion Pictures,[23],
M A Y,14,Narthagi,G. Vijayabathma,"Vivin, Swathi, Kalki, Leema Babu",Drama,Produced by SG Films,[23],
M A Y,20,Kandaen,A. C. Mugil,"Shanthnoo Bhagyaraj, Rashmi Gautham, Santhanam",Romantic comedy,Produced by Sri Sivaselvanayagiamman Movies,[24],
M A Y,20,Maithanam,M. S. Sakthivel,"M. A. Kennedy, Suresh Guru, Jyothi Raj, Swasika",Drama,Produced by Anjana Cinemas,[24],
M A Y,20,Suttum Vizhi Sudare,Thilakar,"Chandru, Vinith, Sushma, Priyashri, Jeeva",Romance,Produced by Nila Films,,
M A Y,27,Eththan,L. Suresh,"Vimal, Sanusha",Action,Produced by Sherali Films,[25],
M A Y,27,Sabash Sariyana Potti,Venu Arvind,"Jayaram, Sriram Karthik, Anjana Thamburatti, Deepa Narendra",Comedy,Produced by Dwaraka Movies,[25],
J U N E,3,Aanmai Thavarael,D. Kuzhandai Velappan,"Dhurva, Shruthi, Sampath Raj",Crime thriller,Produced by Redhead Entertainment,[26],
J U N E,3,Anbirkku Alavillai,"Maryam Kassai, Anand S Babu","Sumeet Pathak, Neetu Chaudhury, Johnny Lever",Romantic drama,Produced by Shepherd India Media Private Limited,[27],
J U N E,3,Oru Santhippil,A. Sridhar,"M. S. Arulmani, Paveena",Adult,Produced by Tristar Movies,[26],
J U N E,10,Aaranya Kaandam,Thiagarajan Kumararaja,"Jackie Shroff, Ravi Krishna, Sampath Raj, Yasmin Ponnappa","Mob, Neo-noir",Produced by Capital Film Works,[28],
J U N E,10,Aasaipadugiren,Balu Manivannan,"Sekhar, Gayathri",Romance,,[29],
J U N E,10,Shanthi Appuram Nithya,Murali Vishwa,"Magha Aditya, Archana Sharma",Erotic thriller,,[30],
J U N E,17,Anaagarigam,Krishna Devan,"Vibu, Prajwal Poovaiah, Vagitha, Rishikesh, Bobbylona",Erotic,,[31],
J U N E,17,Avan Ivan,Bala,"Arya, Vishal, Janani Iyer, Madhu Shalini",Comedy drama,Produced by AGS Entertainment,[31],
J U N E,24,Pillaiyar Theru Kadaisi Veedu,Thirumalai Kishore,"Jithan Ramesh, Sanchita Padukone, Suhasini","Romance, Action",Produced by Super Good Films,[32],
J U N E,24,Udhayan,Chaplin,"Arulnithi, Pranitha Subhash",Action,Produced by Muthamizh Padaippagam,[32],
J U N E,25,Nootrenbadhu,P. Jayendra,"Siddharth, Priya Anand, Nithya Menen",Romantic drama,Produced by SPI Cinemas & Aghal Films,[32],
J U L Y,1,Arumbu Meesai Kurumbu Paarvai,Vetri Veeran,,Romance,Produced by New Line Talkies,[33],"Chandru, Jayanthi"
J U L Y,1,Theneer Viduthi,S. S. Kumaran,,Romance,Produced by Peacock Pictures,[33],"Adith Arun, Reshmi Menon"
J U L Y,7,Venghai,Hari,,Masala,Produced by Vijaya Productions,[34],"Dhanush, Tamannaah Bhatia, Rajkiran"
J U L Y,15,Deiva Thirumagal,A. L. Vijay,,Drama,Produced by Rajakaliamman Medias,[35],"Vikram, Anushka Shetty, Amala Paul, Baby Sara"
J U L Y,22,Kanchana,Raghava Lawrence,,Comedy horror,Produced by Raghava Productions,[36],"Raghava Lawrence, R. Sarathkumar, Lakshmi Rai"
J U L Y,29,Bodinayakkanur Ganesan,Gnanam,,Action,,[37],"Harikumar, Arundhathi, Sai Ravi"
J U L Y,29,Karungali,Kalanjiyam,,Drama,,[37],"Kalanjiyam, Anjali, Srinivas, Sunitha Varma, Asmitha"
J U L Y,29,Markandeyan,FEFSI Vijayan,,Action,,[37],"Sabarash, Savika Chaiyadej (Pinky), Nivedhitha, Srihari"
J U L Y,29,Veppam,Anjana Ali Khan,,Drama,Produced by Photon Kathaas,[37],"Karthik Kumar, Nani, Nithya Menen, Bindu Madhavi"
A U G,5,Doo,Sriram Padmanabhan,,Romance,,[38],"Sanjay, Nakshatra, Sangeetha Bhatt"
A U G,5,Potta Potti,Yuvaraj,,Sports comedy,,[38],"Sadagoppan Ramesh, Harini"
A U G,5,Ramanathapuram,J. J. Hasen,,Romance,,[38],"Rakesh, Archana Sharma"
A U G,12,Konjam Veyil Konjam Mazhai,Ekadasi,,Drama,Produced by FCS Creations,[39],"Tej, Nakshatra, Hansifa"
A U G,12,Rowthiram,Gokul,,Action,Produced by Super Good Films,[39],"Jiiva, Shriya Saran"
A U G,12,Sagakkal,L. Muthukumara Swamy,,Drama,Produced by VVV Creations,[39],"Sanjeev, Advaitha"
A U G,12,Sankarankovil,Palanivel Raja,,Drama,Produced by Sivadarshini Cine Arts,[39],"Kanal Kannan, Rupika Ramnath, Nassar, Prabhu"
A U G,12,Uyarthiru 420,Premnath,,Action,Produced by Rich India Talkies,[39],"Snehan, Meghana Raj, Akshara Gowda, Akshaya, Vaseegaran"
A U G,19,En Ullam Unnai Theduthe,N. Selvaraj,,Romance,,[40],"N. Selvaraj, Manjula Vijayakumar, Anandraj, Dhaamu"
A U G,19,Mittai,M. S. Anbu,,Romance,,,"Santhosh, Prabha, Mayya Unni"
A U G,19,Mudhal Idam,R. Kumaran,,Romantic comedy,Produced by AVM Productions,[40],"Vidharth, Kavitha Nair, Kishore"
A U G,19,Vengayam,Sankagiri Rajkumar,,Drama,,[40],"Satyaraj, Alexander, Paveena"
A U G,26,Puli Vesham,P. Vasu,,Drama,Produced by RK Worlds,[41],"R. K., Karthik, Sadha, Divya Padmini"
A U G,26,Yuvan Yuvathi,G. N. R. Kumaravelan,,Romance,Produced by Ram Pictures,[41],"Bharath, Rima Kallingal"
A U G,31,Mankatha,Venkat Prabhu,,"Action, Thriller",Produced by Cloud Nine Movies,[42],"Ajith Kumar, Arjun, Trisha, Lakshmi Rai, Andrea, Vaibhav, Anjali"
S E P,9,Ayudha Porattam,Jai Akash,,Action,,,"Jai Akash, Preeti Minal, Anita Reddy"
S E P,9,Kasethan Kadavulada,Thirumalai,,Comedy,Jamal Movie Creations,[43],"Saran, Pandiarajan, Karunas, Kamna Jethmalani, Sathyan, Divya Padmini"
S E P,9,Mathikettan Salai,G. Patturajan,,Drama,,,"Adarsh, Divya Nagesh"
S E P,16,Engaeyum Eppothum,M. Saravanan,,Romantic drama,Produced by Murugadoss Productions,[44],"Jai, Anjali, Sharvanand, Ananya"
S E P,16,Vandhaan Vendraan,R. Kannan,,Action thriller,Produced by Vasan Visual Ventures,[44],"Jiiva, Nandha, Taapsee Pannu"
S E P,23,Aayiram Vilakku,S. P. Hosimin,,Drama,Produced by HMI Pictures,[45],"Sathyaraj, Shanthnoo Bhagyaraj, Sana Khan"
S E P,23,Aduthathu,Thakkali Srinivasan,,Thriller,,[46],"Sriman, Meenal, Ilavarasu, Nassar"
S E P,23,Thigattadha Kadhal,Manoj,,Erotic,,[45],
S E P,30,Muran,Rajjan Madhav,,Thriller,Produced by UTV Motion Pictures,[47],"Prasanna, Cheran, Haripriya, Nikita Thukral, Suma Bhattacharya"
S E P,30,Vaagai Sooda Vaa,A. Sargunam,,"Period piece, Romantic drama",Produced by Village Theatres,[47],"Vimal, Iniya, K. Bhagyaraj"
S E P,30,Vedi,Prabhu Deva,,Action-masala,Produced by GK Productions,[47],"Vishal, Sameera Reddy, Poonam Kaur"
O C T,6,Vellore Maavattam,R. N. R. Manohar,,Action,Produced by AGS Entertainment,[48],"Nandha, Poorna"
O C T,8,Sadhurangam,Karu Pazhaniappan,,Political drama,,[48],"Srikanth, Sonia Agarwal"
O C T,7,Raa Raa,Sandilya,,Romantic comedy,,[48],"Udhaya, Shweta Basu Prasad"
O C T,7,Varnam,S. M. Raju,,Drama,,[48],"Giri, Ashwatha, Monica, Sampath Raj"
O C T,7,Varudangal 20,K. Kennedy,,Erotic,,[48],Meenkhotti
O C T,13,Keezhatheru Kicha,N. S. Madhavan,,Comedy,,[49],"Ramesh Ram, Dharsha, Natassha, Ganja Karuppu"
O C T,13,Uyirin Yedai 21 Ayiri,E. L. Indrajith,,Erotic,,[49],"E.L.Indrajith, Thilagan, Sangamithra"
O C T,14,Kaadhal Alla Adhaiyum Thaandi,V. C. Prem,,Romantic drama,,[50],"Pravin Ragav, Asini"
O C T,25,7aum Arivu,A. R. Murugadoss,,Science fiction,Produced by Red Giant Movies,[51],"Suriya, Shruti Haasan, Johnny Tri Nguyen, Avinash"
O C T,26 (Deepavali),Velayudham,M. Raja,,Action-masala,Produced by Aascar Films,[51],"Vijay, Genelia D'Souza, Hansika Motwani, Saranya Mohan"
N O V,11,Konjam Sirippu Konjam Kobam,Sampoornam,,Romance,Produced by Sri Ashtalakshmi Films,[52],"Mahesh, Anusha"
N O V,11,Naan Sivanagiren,V. K. Gnanashekar,,,Produced by MN Creations,[52],"Udhay Karthik, Varsha, Aditya, Prem Kumar"
N O V,11,Thambi Vettothi Sundaram,Vadivudaiyan,,Drama,Produced by JS 24 Frames,[52],"Karan, Anjali, Saravanan"
N O V,18,Vithagan,R. Parthiban,,Action,Produced by Seventh Channel Entertainment,[53],"Parthiban, Poorna, Milind Soman"
N O V,18,Marudhavelu,RKR Adhimolam,,,Produced by S Shanmugapandian,[53],"Kailash, Akansha, Nakshatra"
N O V,25,Mayakkam Enna,Selvaraghavan,,Romantic drama,Produced by Aum Productions,[54],"Dhanush, Richa Gangopadhyay"
N O V,25,Othigai,A. M. Bhaskar,,Romance,,[54],"Jai Akash, Archana Sharma"
N O V,25,Paalai,Senthamizhan,,Drama,,[54],"Shammu, Sunil"
D E C,1,Poraali,Samuthirakani,,Action-Drama film,Produced by Company Productions,[55],"M. Sasikumar, Allari Naresh, Swati Reddy, Vasundhara, Niveda"
D E C,2,Gurusamy,K. R. Manimuthu,,Devotional,Produced by Channel R Five Production,,"Manikandan, Udhayathara, Prem"
D E C,8,Osthe,Dharani,,Action-masala film,Produced by Balaji Real Media,[56],"Silambarasan, Richa Gangopadhyay, Githan Ramesh, Sonu Sood"
D E C,8,Venmani,Kathaka Thirumavalavan,,,Karthik Jai Movies,[57],Karthik Jai
D E C,8,Neeye En Kadhali,Chinni Jayanth,,,,,Chinni Jayanth
D E C,16,Mambattiyan,Thyagarajan,,Action,Produced by Lakshmi Shanthi Movies,,"Prashanth, Meera Jasmine, Mumaith Khan"
D E C,16,Uchithanai Muharnthaal,Pughazhendi Thangaraj,,Drama,Produced by Global Media & Entertainment,,"Neenika, Sathyaraj, Seeman, Sangeetha"
D E C,16,Mouna Guru,Shantha Kumar,,Action,Produced by Mohana Movies,,"Arulnithi, Iniya, John Vijay, Uma Riyaz Khan"
D E C,23,Rajapattai,Suseenthiran,,Action-masala,Produced by PVP Cinema,[58],"Vikram, Deeksha Seth, K. Vishwanath"
D E C,30,Mahaan Kanakku,Sampath,,,,[59],"Ramana, Reecha Sinha"
D E C,30,Maharaja,Manoharan,,Comedy,,[59],"Sathya, Anjali, Nassar, Anita Hassanandani"
D E C,30,Paavi,,,,,[59],
D E C,30,Padhinettan Kudi Ellai Arambam,N. Sundareswaran,,Romance,Produced by SMS Talkies,[59],"Prithvi Rajan, Srinisha"
D E C,30,Karuthakannan Rekla Race,,,,,[59],
D E C,30,Vazhividu Kanney Vazhividu,,,,,[59],
D E C,,,,,,,,
